"","outcome","distribution","opposite_distribution","opposite_countries_count","opposite_countries_prop","countries"
"1","Positive affect",98.331427446364,1.668572553636,0,0,""
"2","Negative affect",87.102123259335,12.897876740665,5,0.147058823529412,"Australia, Japan, Kazakhstan, Macedonia, Norway"
"3","Optimism",94.1407151678416,5.85928483215844,4,0.117647058823529,"China, India, Macedonia, Thailand"
"4","Life satisfaction",86.80705248886,13.19294751114,7,0.205882352941176,"Australia, China, Denmark, France, Ghana, Macedonia, Malaysia"
"5","Envy",86.0260481581959,13.9739518418041,7,0.205882352941176,"Australia, Brazil, Colombia, Japan, Kazakhstan, Macedonia, Turkey"
"6","Indebtedness",87.6040531561742,12.3959468438258,5,0.147058823529412,"Denmark, Netherlands, Poland, Thailand, Turkey"
